{
  "$schema": "https://json-schema.org/draft/2020-12/schema",
  "$id": "/ai/protocol-profile.schema.json",
  "title": "Meow Serial Protocol Profile",
  "type": "object",
  "additionalProperties": true,
  "required": ["name", "kind", "defaultBaudRate"],
  "properties": {
    "id": {
      "type": "string",
      "description": "Optional stable profile id. The app can generate one when absent."
    },
    "name": {
      "type": "string",
      "minLength": 1
    },
    "description": {
      "type": "string"
    },
    "kind": {
      "type": "string",
      "enum": ["line-values", "json-lines", "tlv"]
    },
    "defaultBaudRate": {
      "type": "number",
      "minimum": 1
    },
    "heldChannels": {
      "type": "array",
      "items": { "type": "string" },
      "default": []
    },
    "heldWindowMs": {
      "type": "number",
      "minimum": 0,
      "default": 3000
    },
    "line": {
      "type": "object",
      "additionalProperties": true,
      "properties": {
        "separatorPattern": {
          "type": "string",
          "default": "[,\\t; ]+"
        },
        "channelNames": {
          "type": "array",
          "items": { "type": "string" }
        }
      }
    },
    "json": {
      "type": "object",
      "additionalProperties": true,
      "properties": {
        "fieldPaths": {
          "type": "array",
          "items": { "type": "string" },
          "description": "Dotted numeric field paths. Empty means all top-level numeric fields."
        }
      }
    },
    "tlv": {
      "type": "object",
      "additionalProperties": true,
      "properties": {
        "magicWordHex": { "type": "string" },
        "headerSize": { "type": "number", "minimum": 8 },
        "packetLengthOffset": { "type": "number", "minimum": 0 },
        "packetLengthType": { "type": "string", "enum": ["u16", "u32"] },
        "packetLengthEndian": { "type": "string", "enum": ["little", "big"] },
        "tlvCountOffset": { "type": "number", "minimum": -1 },
        "tlvCountType": { "type": "string", "enum": ["u16", "u32"] },
        "tlvCountEndian": { "type": "string", "enum": ["little", "big"] },
        "tlvHeaderSize": { "type": "number", "minimum": 4 },
        "tlvTypeOffset": { "type": "number", "minimum": 0 },
        "tlvTypeType": { "type": "string", "enum": ["u16", "u32"] },
        "tlvLengthOffset": { "type": "number", "minimum": 0 },
        "tlvLengthType": { "type": "string", "enum": ["u16", "u32"] },
        "tlvHeaderEndian": { "type": "string", "enum": ["little", "big"] },
        "tlvLengthIncludesHeader": { "type": "boolean" },
        "mappings": {
          "type": "array",
          "items": {
            "type": "object",
            "additionalProperties": true,
            "required": ["label", "tlvType", "valueOffset", "valueType", "endian", "scale"],
            "properties": {
              "id": { "type": "string" },
              "label": { "type": "string", "minLength": 1 },
              "tlvType": { "type": "number", "minimum": 0 },
              "valueOffset": { "type": "number", "minimum": 0 },
              "valueType": {
                "type": "string",
                "enum": ["u8", "i8", "u16", "i16", "u32", "i32", "f32", "f64"]
              },
              "endian": { "type": "string", "enum": ["little", "big"] },
              "scale": { "type": "number" },
              "unit": { "type": "string" }
            }
          }
        },
        "fields": {
          "description": "Alias accepted by protocolDocument parser; prefer mappings for direct profile JSON.",
          "type": "array",
          "items": { "type": "object" }
        }
      }
    }
  },
  "allOf": [
    {
      "if": { "properties": { "kind": { "const": "line-values" } } },
      "then": { "required": ["line"] }
    },
    {
      "if": { "properties": { "kind": { "const": "json-lines" } } },
      "then": { "required": ["json"] }
    },
    {
      "if": { "properties": { "kind": { "const": "tlv" } } },
      "then": { "required": ["tlv"] }
    }
  ]
}
